{
 "schema": "arena.deck-cards/1",
 "deck_id": "rev-tithe-extractor",
 "cards": [
  {
   "name": "Rev, Tithe Extractor",
   "qty": 1,
   "zone": "commander",
   "mana_cost": "{3}{B}",
   "type_line": "Legendary Creature \u2014 Human Rogue",
   "color_identity": "B",
   "oracle_text": "Whenever you attack, target creature gains deathtouch until end of turn.\nWhenever one or more creatures you control deal combat damage to a player, create a Treasure token, then look at the top card of that player's library and exile it face down. You may cast that card for as long as it remains exiled. (A Treasure token is an artifact with \"{T}, Sacrifice this token: Add one mana of any color.\")"
  },
  {
   "name": "Academy Manufactor",
   "qty": 1,
   "zone": "main",
   "mana_cost": "{3}",
   "type_line": "Artifact Creature \u2014 Assembly-Worker",
   "color_identity": "C",
   "oracle_text": "If you would create a Clue, Food, or Treasure token, instead create one of each."
  },
  {
   "name": "Agadeem's Awakening // Agadeem, the Undercrypt",
   "qty": 1,
   "zone": "main",
   "mana_cost": "{X}{B}{B}{B}",
   "type_line": "Sorcery // Land",
   "color_identity": "B",
   "oracle_text": "Agadeem's Awakening: Return from your graveyard to the battlefield any number of target creature cards that each have a different mana value X or less.\n//\nAgadeem, the Undercrypt: As this land enters, you may pay 3 life. If you don't, it enters tapped.\n{T}: Add {B}."
  },
  {
   "name": "And\u00faril, Narsil Reforged",
   "qty": 1,
   "zone": "main",
   "mana_cost": "{2}",
   "type_line": "Legendary Artifact \u2014 Equipment",
   "color_identity": "C",
   "oracle_text": "Ascend (If you control ten or more permanents, you get the city's blessing for the rest of the game.)\nWhenever equipped creature attacks, put a +1/+1 counter on each creature you control. If you have the city's blessing, put two +1/+1 counters on each creature you control instead.\nEquip {3}"
  },
  {
   "name": "Balthor the Defiled",
   "qty": 1,
   "zone": "main",
   "mana_cost": "{2}{B}{B}",
   "type_line": "Legendary Creature \u2014 Zombie Dwarf",
   "color_identity": "B",
   "oracle_text": "Minion creatures get +1/+1.\n{B}{B}{B}, Exile Balthor: Each player returns all black and all red creature cards from their graveyard to the battlefield."
  },
  {
   "name": "Barrowgoyf",
   "qty": 1,
   "zone": "main",
   "mana_cost": "{2}{B}",
   "type_line": "Creature \u2014 Lhurgoyf",
   "color_identity": "B",
   "oracle_text": "Deathtouch, lifelink\nBarrowgoyf's power is equal to the number of card types among cards in all graveyards and its toughness is equal to that number plus 1.\nWhenever this creature deals combat damage to a player, you may mill that many cards. If you do, you may put a creature card from among them into your hand."
  },
  {
   "name": "Beseech the Mirror",
   "qty": 1,
   "zone": "main",
   "mana_cost": "{1}{B}{B}{B}",
   "type_line": "Sorcery",
   "color_identity": "B",
   "oracle_text": "Bargain (You may sacrifice an artifact, enchantment, or token as you cast this spell.)\nSearch your library for a card, exile it face down, then shuffle. If this spell was bargained, you may cast the exiled card without paying its mana cost if that spell's mana value is 4 or less. Put the exiled card into your hand if it wasn't cast this way."
  },
  {
   "name": "Bitterbloom Bearer",
   "qty": 1,
   "zone": "main",
   "mana_cost": "{B}{B}",
   "type_line": "Creature \u2014 Faerie Rogue",
   "color_identity": "B",
   "oracle_text": "Flash\nFlying\nAt the beginning of your upkeep, you lose 1 life and create a 1/1 blue and black Faerie creature token with flying."
  },
  {
   "name": "Bitterblossom",
   "qty": 1,
   "zone": "main",
   "mana_cost": "{1}{B}",
   "type_line": "Kindred Enchantment \u2014 Faerie",
   "color_identity": "B",
   "oracle_text": "At the beginning of your upkeep, you lose 1 life and create a 1/1 black Faerie Rogue creature token with flying."
  },
  {
   "name": "Blackbloom Rogue // Blackbloom Bog",
   "qty": 1,
   "zone": "main",
   "mana_cost": "{2}{B}",
   "type_line": "Creature \u2014 Human Rogue // Land",
   "color_identity": "B",
   "oracle_text": "Blackbloom Rogue: Menace (This creature can't be blocked except by two or more creatures.)\nThis creature gets +3/+0 as long as an opponent has eight or more cards in their graveyard.\n//\nBlackbloom Bog: This land enters tapped.\n{T}: Add {B}."
  },
  {
   "name": "Braids, Arisen Nightmare",
   "qty": 1,
   "zone": "main",
   "mana_cost": "{1}{B}{B}",
   "type_line": "Legendary Creature \u2014 Nightmare",
   "color_identity": "B",
   "oracle_text": "At the beginning of your end step, you may sacrifice an artifact, creature, enchantment, land, or planeswalker. If you do, each opponent may sacrifice a permanent of their choice that shares a card type with it. For each opponent who doesn't, that player loses 2 life and you draw a card."
  },
  {
   "name": "Cabal Coffers",
   "qty": 1,
   "zone": "main",
   "mana_cost": "",
   "type_line": "Land",
   "color_identity": "B",
   "oracle_text": "{2}, {T}: Add {B} for each Swamp you control."
  },
  {
   "name": "Changeling Outcast",
   "qty": 1,
   "zone": "main",
   "mana_cost": "{B}",
   "type_line": "Creature \u2014 Shapeshifter",
   "color_identity": "B",
   "oracle_text": "Changeling (This card is every creature type.)\nThis creature can't block and can't be blocked."
  },
  {
   "name": "Chthonian Nightmare",
   "qty": 1,
   "zone": "main",
   "mana_cost": "{1}{B}",
   "type_line": "Enchantment",
   "color_identity": "B",
   "oracle_text": "When this enchantment enters, you get {E}{E}{E} (three energy counters).\nPay X {E}, Sacrifice a creature, Return this enchantment to its owner's hand: Return target creature card with mana value X from your graveyard to the battlefield. Activate only as a sorcery."
  },
  {
   "name": "Cranial Plating",
   "qty": 1,
   "zone": "main",
   "mana_cost": "{2}",
   "type_line": "Artifact \u2014 Equipment",
   "color_identity": "B",
   "oracle_text": "Equipped creature gets +1/+0 for each artifact you control.\n{B}{B}: Attach this Equipment to target creature you control.\nEquip {1}"
  },
  {
   "name": "Dark Ritual",
   "qty": 1,
   "zone": "main",
   "mana_cost": "{B}",
   "type_line": "Instant",
   "color_identity": "B",
   "oracle_text": "Add {B}{B}{B}."
  },
  {
   "name": "Dauthi Voidwalker",
   "qty": 1,
   "zone": "main",
   "mana_cost": "{B}{B}",
   "type_line": "Creature \u2014 Dauthi Rogue",
   "color_identity": "B",
   "oracle_text": "Shadow (This creature can block or be blocked by only creatures with shadow.)\nIf a card would be put into an opponent's graveyard from anywhere, instead exile it with a void counter on it.\n{T}, Sacrifice this creature: Choose an exiled card an opponent owns with a void counter on it. You may play it this turn without paying its mana cost."
  },
  {
   "name": "Deadly Rollick",
   "qty": 1,
   "zone": "main",
   "mana_cost": "{3}{B}",
   "type_line": "Instant",
   "color_identity": "B",
   "oracle_text": "If you control a commander, you may cast this spell without paying its mana cost.\nExile target creature."
  },
  {
   "name": "Deep-Cavern Bat",
   "qty": 1,
   "zone": "main",
   "mana_cost": "{1}{B}",
   "type_line": "Creature \u2014 Bat",
   "color_identity": "B",
   "oracle_text": "Flying, lifelink\nWhen this creature enters, look at target opponent's hand. You may exile a nonland card from it until this creature leaves the battlefield."
  },
  {
   "name": "Drana, Liberator of Malakir",
   "qty": 1,
   "zone": "main",
   "mana_cost": "{1}{B}{B}",
   "type_line": "Legendary Creature \u2014 Vampire Ally",
   "color_identity": "B",
   "oracle_text": "Flying, first strike\nWhenever Drana deals combat damage to a player, put a +1/+1 counter on each attacking creature you control."
  },
  {
   "name": "Elegy Acolyte",
   "qty": 1,
   "zone": "main",
   "mana_cost": "{2}{B}{B}",
   "type_line": "Creature \u2014 Human Cleric",
   "color_identity": "B",
   "oracle_text": "Lifelink\nWhenever one or more creatures you control deal combat damage to a player, you draw a card and lose 1 life.\nVoid \u2014 At the beginning of your end step, if a nonland permanent left the battlefield this turn or a spell was warped this turn, create a 2/2 colorless Robot artifact creature token."
  },
  {
   "name": "Emergence Zone",
   "qty": 1,
   "zone": "main",
   "mana_cost": "",
   "type_line": "Land",
   "color_identity": "C",
   "oracle_text": "{T}: Add {C}.\n{1}, {T}, Sacrifice this land: You may cast spells this turn as though they had flash."
  },
  {
   "name": "Exsanguinate",
   "qty": 1,
   "zone": "main",
   "mana_cost": "{X}{B}{B}",
   "type_line": "Sorcery",
   "color_identity": "B",
   "oracle_text": "Each opponent loses X life. You gain life equal to the life lost this way."
  },
  {
   "name": "Feed the Swarm",
   "qty": 1,
   "zone": "main",
   "mana_cost": "{1}{B}",
   "type_line": "Sorcery",
   "color_identity": "B",
   "oracle_text": "Destroy target creature or enchantment an opponent controls. You lose life equal to that permanent's mana value."
  },
  {
   "name": "Fell the Profane // Fell Mire",
   "qty": 1,
   "zone": "main",
   "mana_cost": "{2}{B}{B}",
   "type_line": "Instant // Land",
   "color_identity": "B",
   "oracle_text": "Fell the Profane: Destroy target creature or planeswalker.\n//\nFell Mire: As this land enters, you may pay 3 life. If you don't, it enters tapped.\n{T}: Add {B}."
  },
  {
   "name": "Finale of Eternity",
   "qty": 1,
   "zone": "main",
   "mana_cost": "{X}{B}{B}",
   "type_line": "Sorcery",
   "color_identity": "B",
   "oracle_text": "Destroy up to three target creatures with toughness X or less. If X is 10 or more, return all creature cards from your graveyard to the battlefield."
  },
  {
   "name": "Gemstone Caverns",
   "qty": 1,
   "zone": "main",
   "mana_cost": "",
   "type_line": "Legendary Land",
   "color_identity": "C",